{
  "businessName": "L&B Aesthetic Suppliers",
  "tagline": "Premium Aesthetic Supplies for Beauty Professionals",
  "email": "sales@lbaestheticsuppliers.com",
  "address": "20 Wenlock Road\nLondon\nN1 7GU",
  "bankName": "Monzo",
  "bankSortCode": "04-06-05",
  "bankAccountNumber": "32273478",
  "bankAccountName": "L&B Aesthetic Suppliers",
  "dispatchTimeframe": "3–5 working days",
  "instagramUrl": "https://instagram.com/lbaestheticsuppliers",
  "facebookUrl": "https://facebook.com/lbaestheticsuppliers",
  "tiktokUrl": "https://tiktok.com/@lbaestheticsuppliers"
}
